{
  "account_sid" : "AC5ef8732a3c49700934481addd5ce1659" ,
  "api_version" : "2010-04-01" ,
  "body" : "Hey Jenny why aren't you returning my calls?" ,
  "num_segments" : "1" ,
  "num_media" : "0" ,
  "date_created" : "Mon, 16 Aug 2010 03:45:01 +0000" ,
  "date_sent" : "Mon, 16 Aug 2010 03:45:03 +0000" ,
  "date_updated" : "Mon, 16 Aug 2010 03:45:03 +0000" ,
  "direction" : "outbound-api" ,
  "from" : "+14158141829" ,
  "price" : "-0.02000" ,
  "sid" : "MM800f449d0399ed014aae2bcc0cc2f2ec" ,
  "status" : "sent" ,
  "to" : "+15558675309" ,
  "uri" : "/2010-04-01/Accounts/AC5ef872f6da5a21de157d80997a64bd33/Messages/MM800f449d0399ed014aae2bcc0cc2f2ec.json"
}